{
  "dataset": "hsk-words",
  "version": "test",
  "standard": "test",
  "license": "test",
  "counts": { "words": 1, "byHsk3Level": {}, "meaningViSource": { "machine": 1 } },
  "words": [
    {
      "officialIndex": null,
      "simplified": "摩托",
      "traditional": null,
      "variants": [],
      "pinyin": "mo2 tuo1",
      "hsk3Level": null,
      "hsk2Level": null,
      "hskExam2026Level": null,
      "pathOrder": null,
      "frequencyRank": null,
      "pos": ["n"],
      "usageNote": null,
      "meaningsEn": ["motor"],
      "meaningsVi": ["xe máy"],
      "meaningViStatus": "machine",
      "meaningViSource": "machine",
      "hanViet": "ma thác",
      "hanVietStatus": "derived",
      "sources": ["test"]
    }
  ]
}
