{
  "dataset": "hsk-words",
  "version": "test",
  "standard": "test",
  "license": "test",
  "counts": { "words": 1, "byHsk3Level": {}, "meaningViSource": { "machine": 1 } },
  "words": [
    {
      "officialIndex": null,
      "simplified": "淼鑫",
      "traditional": null,
      "variants": [],
      "pinyin": "miao3 xin1",
      "hsk3Level": null,
      "hsk2Level": null,
      "hskExam2026Level": null,
      "pathOrder": null,
      "frequencyRank": null,
      "pos": ["n"],
      "usageNote": null,
      "meaningsEn": ["test word v2 — CHANGED"],
      "meaningsVi": ["nghĩa khác hoàn toàn — KHÔNG được ghi đè"],
      "meaningViStatus": "machine",
      "meaningViSource": "machine",
      "hanViet": "hâm diểu (đổi thứ tự — KHÔNG được ghi đè)",
      "hanVietStatus": "derived",
      "sources": ["test"]
    }
  ]
}
