{
  "dataset": "hsk-words",
  "version": "test",
  "standard": "test",
  "license": "test",
  "counts": { "words": 1, "byHsk3Level": {}, "meaningViSource": { "machine": 1 } },
  "words": [
    {
      "officialIndex": null,
      "simplified": "测验",
      "traditional": "測驗",
      "variants": [],
      "pinyin": "ce4 yan4",
      "hsk3Level": null,
      "hsk2Level": null,
      "hskExam2026Level": null,
      "pathOrder": null,
      "frequencyRank": null,
      "pos": ["v"],
      "usageNote": null,
      "meaningsEn": ["to test"],
      "meaningsVi": ["kiểm tra; thử nghiệm"],
      "meaningViStatus": "machine",
      "meaningViSource": "machine",
      "hanViet": "trắc nghiệm",
      "hanVietStatus": "derived",
      "sources": ["test"]
    }
  ]
}
